external_id,license_code,state_code,category_code,text,explanation,image_name,difficulty,lang
CDL-HZ-0074,cdl,,hazmat,Which of the following hazard classes uses a transport index to determine how much of it can be loaded on a single vehicle for transport?,"Some packages of Class 7 (Radioactive) materials bear a number called the ""transport index."" The shipper labels these packages Radioactive II or Radioactive III and prints the package's transport index on the label.",,1,en
CDL-HZ-0075,cdl,,hazmat,Which of the following are necessary qualifications for non-bulk packaging?,"Non-bulk packaging: A maximum capacity of 450 L (119 gallons) as a receptacle for a liquid; A maximum net mass less than 400 kg (882 pounds) and a maximum capacity of 450 L (119 gallons) or less as a receptacle for a solid; or A water capacity greater than 454 kg (1,000 pounds) or less as a receptacle for a gas.",,1,en
CDL-HZ-0076,cdl,,hazmat,Why does the government regulate the transportation of hazardous materials?,"Hazardous materials are products that pose a risk to health, safety, and property during transportation. Hazardous materials include explosives, various types of gas, solids, flammable and combustible liquid, and other materials. Because of the risks involved and the potential consequences these risks impose, all levels of government regulate the handling of hazardous materials.",,1,en
CDL-HZ-0077,cdl,,hazmat,A properly prepared uniform hazardous waste manifest,"When transporting hazardous wastes, you must sign by hand and carry a Uniform Hazardous Waste Manifest. Shippers must prepare, date, and sign by hand the manifest. Each carrier transporting the shipment must sign by hand the manifest. Each copy must have all needed signatures and dates, including those of the person to whom you delivered the waste.",,1,en
CDL-HZ-0078,cdl,,hazmat,"Identification numbers are preceded by the letters ""UN"" or ""NA."" The letters ""NA"" are associated with proper shipping names that are used where?","The letters ""NA"" are associated with proper shipping names that are only used within the United States and to and from Canada",,1,en
CDL-HZ-0079,cdl,,hazmat,You may not park a vehicle carrying hazardous materials within _____ feet of an open fire.,"Do not park within 300 feet of: A bridge, tunnel, building, a place where people gather, or an open fire. If you must park to do your job, do so only briefly.",,1,en
CDL-HZ-0080,cdl,,hazmat,What type fire extinguisher is required in the power unit of a placarded vehicle?,The power unit of placarded vehicles must have a fire extinguisher with a UL rating of 10 B:C or more.,,1,en
CDL-HZ-0081,cdl,,hazmat,"To find out if a shipment includes a hazardous material, you should:","Learn to recognize shipments of hazardous materials. To find out if the shipment includes hazardous materials, look at the shipping paper.",,1,en
CDL-HZ-0082,cdl,,hazmat,Cylinders containing compressed gases may only be loaded onto a vehicle without a flat floor or platform if the cylinders are:,"The cylinders must be: Held upright, or in racks attached to the vehicle",,1,en
CDL-HZ-0083,cdl,,hazmat,You are hauling hazardous materials and you find that one of your tires is leaking. You must:,Do not drive with a tire that is leaking or flat except to the nearest safe place to fix it.,,1,en
CDL-HZ-0084,cdl,,hazmat,Shipping papers must always be kept in one place when driving with hazardous materials. Where when wearing your seat belt?,"Drivers are to keep hazardous materials shipping papers: In a pouch on the driver's door, or in clear view within immediate reach while the seat belt is fastened while driving, or on the driver's seat when out of the vehicle.",,1,en
CDL-HZ-0085,cdl,,hazmat,"The hazardous material identification numbers must be displayed on portable tanks, cargo tanks, and other bulk packaging. The regulations require black _______ numbers.","The rules require black 100 mm (3.9 inch) numbers on orange panels, placards, or a white, diamond-shaped background if no placards are required.",,1,en
CDL-HZ-0086,cdl,,hazmat,The Emergency Response Guidebook (ERG),"The Department of Transportation has a guidebook for firefighters, police, and industry workers on how to protect themselves and the public from hazardous materials. The guide is indexed by proper shipping name and hazardous materials identification number. Emergency personnel look for these things on the shipping paper. That is why it is vital that the proper shipping name, identification number, label, and placards are correct.",,1,en
CDL-HZ-0087,cdl,,hazmat,You should stop before crossing a railroad grade if your vehicle is carrying _______ of chlorine.,"Stop before a railroad crossing if your vehicle: Is placarded, carries any amount of chlorine, has cargo tanks, whether loaded or empty used for hazardous materials.",,1,en
CDL-HZ-0088,cdl,,hazmat,"If you are in an accident involving hazardous materials, you should:","As a professional driver, your job at the scene of a crash or an incident is to: Keep people away. Limit the spread of material, if you can safely do so. Communicate the danger of the hazardous materials Provide emergency responders with the shipping papers and emergency response information.",,1,en
CDL-HZ-0089,cdl,,hazmat,It is recommended that when hauling a load of explosives 1.1 or 1.3 to use the fusees instead of the warning triangles if in an emergency or breakdown situation?,"You might break down and have to use stopped vehicle signals. Use reflective triangles or red electric lights, never use burning signals, such as flares or fuses around a tank used for Class 3 (Flammable Liquids) or Division 2.1 (Flammable Gas) whether loaded or empty, and any vehicle loaded with Division 1.1, 1.2, or 1.3 Explosives.",,1,en
CDL-HZ-0090,cdl,,hazmat,"Who is responsible for packaging, labeling, and preparing the hazardous material shipping papers for a common carrier?","Must package, mark, and label the materials; prepare shipping papers; provide emergency response information; and supply placards.",,1,en
CDL-HZ-0091,cdl,,hazmat,Class 1.1 explosives must not be transported in a combination vehicle if the vehicle includes:,"Do not transport Division 1.1 or 1.2 in vehicle combinations if: There is a marked or placarded cargo tank in the combination. The other vehicle in the combination contains: Division 1.1 A (Initiating Explosives). Packages of Class 7 (Radioactive) materials labeled ""Yellow III."" Division 2.3 (Poisonous Gas) or Division 6.1 (Poisonous) materials. Hazardous materials in a portable tank, on a DOT Spec 106A or 110A tank.",,1,en
CDL-HZ-0092,cdl,,hazmat,"A vehicle contains 500 pounds each of explosives 1.1 and 1.3, you must use:",Use the larger or more dangerous placard of explosives 1.1.,,1,en
CDL-HZ-0093,cdl,,hazmat,"A railroad crossing is ahead of you and you are hauling hazardous material. When you stop for the crossing, you can stop as far away as _____ feet from the nearest rail.","You must stop 15 to 50 feet before the nearest rail. Proceed only when you are sure no train is coming, and you can clear the tracks without stopping. Don't shift gears while crossing the tracks.",,1,en
CDL-HZ-0094,cdl,,hazmat,The hazardous waste manifest should be?,Hazardous waste need to be kept on top of all other paperwork and tabbed differently so that it is easy to find.,,1,en
CDL-HZ-0095,cdl,,hazmat,"Column 1 or the symbols column the ""+"" sign means:","The ""+"" sign shows the proper shipping name, hazard class, and packing group to use, even if the material doesn't meet the hazard class definition",,1,en
CDL-HZ-0096,cdl,,hazmat,How often should you check the tires on a placarded trailer that has dual tires?,"Check the tire mounting and air pressure. Inspect the tires every two hours, every 100 miles, and each time you stop.",,1,en
CDL-HZ-0097,cdl,,hazmat,"Whenever you load or unload a cargo tank, a qualified person must be","The person in charge of loading and unloading a cargo tank must be sure a qualified person is always watching. This person watching the loading or unloading must: Be alert, have a clear view of the cargo tank, be within 25 feet of the tank, know of the hazards of the materials involved, know the procedures to follow in an emergency, and be authorized to move the cargo tank and able to do so.",,1,en
CDL-HZ-0098,cdl,,hazmat,Containment rules specify,"Many hazardous products can injure or kill on contact. To protect drivers and others from contact, the rules tell shippers how to package safely. Similar rules tell drivers how to load, transport, and unload bulk tanks. These are containment rules.",,1,en
CDL-HZ-0099,cdl,,hazmat,Smoking must be at least _____ feet from most hazardous material?,"Do not smoke within 25 feet of a placarded cargo tank used for Class 3 (flammable liquids),Division 2.1 (gases), or Class 1 (Explosives) Class 3 (Flammable Liquids) Class 4 (Flammable Solids) Class 4.2 (Spontaneously Combustible).",,1,en
CDL-HZ-0100,cdl,,hazmat,"In the hazardous material table, column 3, any shipping name written in italics means?","Names shown in italics are not proper shipping names, those in roman type above it are.",,1,en
CDL-HZ-0101,cdl,,hazmat,"If hazardous material is spilling from your vehicle, do not move your vehicle:","If hazardous materials are spilling from your vehicle, do not move it any more than safety requires.",,1,en
CDL-HZ-0102,cdl,,hazmat,How often must a driver that has the Hazmat Endorsement on their CDL retake the state Hazmat written test?,"Generally, you must renew every five years, although some states may require more frequent reviews based on shorter license cycles. You will be required to submit new fingerprints at the time of renewal of the endorsement.",,1,en
CDL-HZ-0103,cdl,,hazmat,Do you need to stop before a railroad crossing if you are hauling 100 pounds of Division 4.3 materials?,"Stop before a railroad crossing if your vehicle: Is placarded, carries any amount of chlorine, has cargo tanks whether loaded or empty used for hazardous materials.",,1,en
CDL-HZ-0104,cdl,,hazmat,"You are transporting hazardous materials. When you are not behind the wheel, the shipping papers must be on the driver's seat or","You must also keep shipping papers: In a pouch on the driver's door, or in clear view within reach while driving, or on the driver's seat when out of the vehicle.",,1,en
CDL-HZ-0105,cdl,,hazmat,Which of the following is the proper definition of a cargo tank?,Cargo tanks are bulk packaging permanently attached to a vehicle. Cargo tanks remain on the vehicle when you load and unload them.,,1,en
CDL-HZ-0106,cdl,,hazmat,"A truck has hazardous material, when can it be moved without the placards on the truck?","You are only allowed to move an improperly placarded vehicle during an emergency, in order to protect life or property",,1,en
CDL-HZ-0107,cdl,,hazmat,"The basic description of a hazardous material includes the hazard class, the id number, and the proper shipping name. Which one must appear first on the shipping paper?","The basic description of hazardous materials includes the identification number, proper shipping name, hazard class or division, and the packing group, if any, in that order.",,1,en
CDL-HZ-0108,cdl,,hazmat,A vehicle contains 500 pounds each of Division 1.1 explosives and Division 1.2 explosives. You must have,"The Placards Table 1 contains explosives, so any amount being transported needs to have placards displayed on the vehicle, with the proper division number.",,1,en
CDL-HZ-0109,cdl,,hazmat,"When hauling hazardous materials, you must check any dual tires","If you have a placarded trailer with dual tires, you should check the tires at the start of each trip and each time that you stop for any reason, whether to rest or to refuel. Use a tire pressure gauge to get an accurate reading.",,1,en
CDL-HZ-0110,cdl,,hazmat,Which three hazard classes should not be loaded into a trailer that has a heater or air conditioner unit.,Anything explosive or flammable should not be loaded into a trailer with heaters or air conditioners because of the possibility of a malfunction creating a spark that could lead to an explosion.,,1,en
CDL-HZ-0111,cdl,,hazmat,"The intent of hazardous materials regulations is to ensure safety, to contain the material, and:",The three intents are: Contain the Material; Communicate the Risk; and Assure Safe Drivers and Equipment.,,1,en
CDL-HZ-0112,cdl,,hazmat,"If you are carrying Division 1.2 or 1.3 materials, how far away must you park from the traveled portion of the roadway?","Never park with Division 1.1, 1.2, or 1.3 explosives within five feet of the traveled part of the road.",,1,en
CDL-HZ-0113,cdl,,hazmat,Why must the shipper sign the shipping paper?,"A statement on a shipping paper, signed by the shipper, saying they prepared the shipment properly according to law.",,1,en
CDL-HZ-0114,cdl,,hazmat,"You find an overheated tire during an enroute inspection. If you are hauling hazardous materials, you must:",Remove any overheated tire. Place it a safe distance from your vehicle. Don't drive until you correct the cause of the overheating.,,1,en
CDL-PS-0001,cdl,,passenger,You must stop your bus between:,Stop your bus between 15 and 50 feet before railroad crossings. Listen and look in both directions for trains.,,1,en
CDL-PS-0002,cdl,,passenger,"You need to evacuate your bus in an emergency, passengers should be directed to a safe place no less than _____ feet from the bus.",Passengers should be moved at least 100 feet from the bus.,,1,en
CDL-PS-0003,cdl,,passenger,Off tracking of the rear wheels is affected by:,"Off tracking can be changed by speed, the sharpness of the turn, and the distance between the front and rear wheels.",,1,en
CDL-PS-0004,cdl,,passenger,"Your bus is disabled. The bus, with riders aboard, may be towed or pushed to a safe place only:","Do not tow or push a disabled bus with riders aboard the vehicle, unless getting off would be unsafe. Only tow or push the bus to the nearest safe spot to discharge passengers.",,1,en
CDL-PS-0005,cdl,,passenger,"When driving at more than 40 mph, what is the safe minimum following distance for ideal daytime conditions?","One good rule says you need at least one second for each 10 feet of vehicle length at speeds below 40 mph. At greater speeds, you must add 1 second for safety.",,1,en
CDL-PS-0006,cdl,,passenger,"If you have riders aboard, you must never fuel your bus:",Avoid fueling your bus with riders on board unless absolutely necessary. Never refuel in a closed building with riders on board.,,1,en
CDL-PS-0007,cdl,,passenger,Carry-on baggage cannot be stored:,Do not allow riders to leave carry-on baggage in a doorway or aisle. There should be nothing in the aisle that might trip other riders.,,1,en
CDL-PS-0008,cdl,,passenger,The driver's seat should be adjusted:,Seat adjustments should only be made when the vehicle is stopped.,,1,en
CDL-PS-0009,cdl,,passenger,Buses may have recapped or re-grooved tires:,Recapped or re-grooved tires can be on any axle except the front or steer axel.,,1,en
CDL-PS-0010,cdl,,passenger,"When you are not sure who has the right of way, the safest course of action is to:",When in doubt be courteous and allow the other driver the right of way.,,1,en
CDL-PS-0011,cdl,,passenger,Commercial bus drivers must have a CDL if:,You must have a CDL to operate a vehicle designed to transport 16 or more passengers including the driver.,,1,en
CDL-PS-0012,cdl,,passenger,The interlock system for the brake and accelerator on a transit coach may be used:,"Urban mass transit coaches may have a brake and accelerator interlock system. The interlock applies the brakes and holds the throttle in idle position when the rear door is open, releasing when the door is closed. Do not use this safety feature in place of the parking brake.",,1,en
CDL-PS-0013,cdl,,passenger,"According to federal regulations, the minimum depth required for tire tread on steering axle tires is _____ of an inch.",The minimum tread depth for commercial vehicles on the front or steer axel is 4/32 of an inch.,,1,en
CDL-PS-0014,cdl,,passenger,Which of these forms of signaling is not recommended?,"Some drivers try to help out others by signaling when it is safe to pass. You should not do this. You could cause an accident. You could be blamed, and it could cost you many thousands of dollars.",,1,en
CDL-PS-0015,cdl,,passenger,The standee line is:,Buses designed to allow standing must have a two-inch line on the floor or some other means of showing riders where they cannot stand. This is called the standee line. All standing riders must stay behind it.,,1,en
CDL-PS-0016,cdl,,passenger,All the following should be in good working order before driving. Which item must be in good working order before the bus can leave?,The service brake should be tested and in working order before leaving.,,1,en
CDL-PS-0017,cdl,,passenger,At the end of each shift you should:,"At the end of your shift you should do your post trip inspection, reporting any defects or repairs needed, and take all of your personal belongings.",,1,en
CDL-PS-0018,cdl,,passenger,"Before you start to drive, you must inspect all of the following EXCEPT","Before you start to drive, you must check all the critical systems such as steering, brakes, tires, and emergency equipment to be sure they work properly. For the passengers' safety, you must also check such interior items as seats, handholds, railings, signaling devices, and emergency exits",,1,en
CDL-PS-0019,cdl,,passenger,The traffic light on a drawbridge is green. You should,"You do not need to stop, but must slow down and make sure it's safe, when: there is a traffic light showing green, or the bridge has an attendant or traffic officer who controls traffic whenever the bridge opens",,1,en
CDL-PS-0020,cdl,,passenger,"If you are performing your vehicle inspection test on a coach or transit bus, you will have to inspect the baggage compartments and make sure that the baggage compartment doors ________ securely.","As you check the outside of the bus, close any open emergency exits. Also, close any open access panels (for baggage, restroom service, engine, etc.) before driving, and make sure all are latched properly.",,1,en
CDL-PS-0021,cdl,,passenger,Bus accidents often happen,"Bus accidents often happen at intersections. Use caution, even if a signal or stop sign controls other traffic.",,1,en
CDL-PS-0022,cdl,,passenger,"When stopping for railroad tracks, you must stop no closer than how many feet before the nearest track?",You must stop between 15 and 50 feet from the nearest rail at a railroad crossing.,,1,en
CDL-PS-0023,cdl,,passenger,"When transporting passengers on charter or intercity buses, you should explain passenger comfort and safety rules","Many charter and intercity carriers have passenger comfort and safety rules. Mention rules about smoking, drinking, or use of radio and tape players at the start of the trip. Explaining the rules at the start will help to avoid trouble later on.",,1,en
CDL-PS-0024,cdl,,passenger,Which of the following statements are true?,"Do not tow or push a disabled bus with riders aboard the vehicle, unless getting off would be unsafe. Only tow or push the bus to the nearest safe spot to discharge passengers.",,1,en
CDL-PS-0025,cdl,,passenger,Federal regulations set an axle weight limit of _____ pounds on a tandem axle that is four feet apart.,"Federal law states that single axles are limited to 20,000 pounds, and axles spaced more than 40 inches and not more than 96 inches apart (tandem axles) are limited to 34,000 pounds.",,1,en
CDL-PS-0026,cdl,,passenger,At drawbridges with no signal you must stop at least:,Stop at drawbridges that do not have a signal light or traffic control attendant. Stop at least 50 feet before the draw of the bridge. Look to make sure the draw is completely closed before crossing.,,1,en
CDL-PS-0027,cdl,,passenger,A bus may carry baggage or freight only if it is secured so that:,"Secure baggage and freight in ways that avoid damage and: allow the driver to move freely and easily, allow riders to exit by any window or door in an emergency, and protect riders from injury if carry-ons fall or shift.",,1,en
CDL-PS-0028,cdl,,passenger,"In general, standees on a bus are not permitted:",Buses designed to allow standing must have a two-inch line on the floor or some other means of showing riders where they cannot stand. This is called the standee line. All standing riders must stay behind it.,,1,en
CDL-PS-0029,cdl,,passenger,Rules require shippers to mark containers of hazardous materials with:,"The rules require shippers to mark containers of hazardous material with the material's name, identification number, and hazard label.",,1,en
CDL-PS-0030,cdl,,passenger,The following are some situations that require special attention from all drivers. Which one is an even bigger problem for the driver of a vehicle with a low ground clearance?,With the low ground clearance humps or dips in the road would present more of a hazard.,,1,en
CDL-PS-0031,cdl,,passenger,"A straight vehicle weighing 20,000 pounds which hauls 20 passengers falls into which CDL class:","A vehicle with no articulation (Class A has articulation), weighing less than 26,001 pounds (Class B is 26,001 or more) would fall under Class C.",,1,en
CDL-PS-0032,cdl,,passenger,Prohibited practices on the bus include:,"Avoid fueling your bus with riders on board unless absolutely necessary, never refuel in a closed building with riders on board, don't talk with riders or engage in any other distracting activity while driving, and do not tow or push a disabled bus with riders aboard the vehicle unless getting off would be unsafe.",,1,en
CDL-PS-0033,cdl,,passenger,You must put a loaded bus into motion from a stopped position on a steep upgrade. Which of these is the best technique to follow when you have a bus with a manual transmission?,"Releasing the clutch slowly until you feel the vehicle start to pull against the parking brake, and then releasing the parking brake should allow the vehicle to move without rolling.",,1,en
CDL-PS-0034,cdl,,passenger,"You may sometimes haul small arms ammunition, emergency shipments of drugs, or hospital supplies on a bus. The total weight of all such hazardous materials must not be greater than _____ pounds.","A bus cannot carry more than 500 pounds total of allowed hazardous materials, and no more than 100 pounds of any one class.",,1,en
CDL-PS-0035,cdl,,passenger,Which of these is a good rule for backing a straight bus?,"Because you cannot see everything behind your vehicle, backing is always dangerous. Avoid backing whenever you can. When you have to back, here are a few simple safety rules: start in the proper position, look at your path, use mirrors on both sides, back slowly, back and turn toward the driver's side whenever possible, and use a helper whenever possible.",,1,en
CDL-PS-0036,cdl,,passenger,How are buses to handle most railroad grade crossings?,Stop your bus between 15 and 50 feet before railroad crossings. Listen and look in both directions for trains.,,1,en
CDL-PS-0037,cdl,,passenger,Which of the following statements about hazardous materials are FALSE?,"Buses may carry small-arms ammunition labeled ORM-D, emergency hospital supplies, and drugs that are properly labeled. You can carry small amounts of some other hazardous materials if the shipper cannot send them any other way. Most hazardous material may not be carried on a bus.",,1,en
CDL-PS-0038,cdl,,passenger,"If a passenger is drunk or disruptive, you may","Occasionally, you may have a drunk or disruptive rider. You must ensure this rider's safety as well as that of others. Don't discharge such riders where it would be unsafe for them. It may be safer at the next scheduled stop or a well-lighted area where there are other people.",,1,en
CDL-PS-0039,cdl,,passenger,Always check the interior of the bus before driving to ensure rider safety. What are you looking for?,"Aisles and stairwells should always be clear. The following parts of your bus must be in safe working condition: The ""Emergency Exit"" sign on an emergency door must be clearly visible, the seats must be safe for riders and securely fastened to the bus, among others.",,1,en
CDL-PS-0040,cdl,,passenger,"To prevent theft and vandalism on a charter bus,",Charter bus drivers should not allow riders on the bus until departure time. This will help prevent theft or vandalism of the bus.,,1,en
CDL-PS-0041,cdl,,passenger,"When pulling out of a bus stop,",School and mass transit buses sometimes scrape off mirrors or hit passing vehicles when pulling out from a bus stop. Remember the clearance your bus needs and watch for poles and tree limbs at stops.,,1,en
CDL-PS-0042,cdl,,passenger,Which of the following answers lists the three types of emergency equipment you must have on your bus?,"You must have a fire extinguisher 10 BC or better, spare electrical fuses, and emergency reflective triangles.",,1,en
CDL-PS-0043,cdl,,passenger,"Do to the extreme size of a bus, the driver must watch for:",Remember the clearance your bus needs and watch for poles and tree limbs at stops.,,1,en
CDL-PS-0044,cdl,,passenger,When do you sign post inspection reports?,,,1,en
CDL-PS-0045,cdl,,passenger,"If a rider wants to bring a car battery or a can of gasoline aboard your bus, you should:",Riders sometimes board a bus with an unlabeled hazardous material. Do not allow riders to carry on common hazards such as car batteries or gasoline,,1,en
CDL-PS-0046,cdl,,passenger,When arriving at the destination announce:,"When arriving at the destination or intermediate stops announce: the location, reason for stopping, next departure time, and bus number.",,1,en
