external_id,license_code,state_code,category_code,text,explanation,image_name,difficulty,lang
CDL-GK-0266,cdl,,general_knowledge,"If you do not have a CB radio, what is the first thing you should do at an accident scene?","The basic steps to be taken at any accident are to: protect the area, notify authorities, care for the injured.",,1,en
CDL-GK-0267,cdl,,general_knowledge,The oil pressure gauge should come up to normal within how long after starting the engine?,Oil pressure. Should come up to normal within seconds after engine is started.,,1,en
CDL-GK-0268,cdl,,general_knowledge,The distance your vehicle travels from the time your eyes see a hazard to the time your brain recognizes it is called _______ distance.,"The distance your vehicle travels, in ideal conditions; from the time your eyes see a hazard until your brain recognizes it is perception distance.",,1,en
CDL-GK-0269,cdl,,general_knowledge,Stab braking should not be used on vehicles with,"In stab braking you deliberately keep locking and unlocking the wheels, and ABS is a computerized system that keeps your wheels from locking up during hard brake applications. Do not use Stab braking with ABS, use controlled braking instead.",,1,en
CDL-GK-0270,cdl,,general_knowledge,When should you downshift an automatic transmission?,You can select a low range to get greater engine braking when going down grades. The lower ranges prevent the transmission from shifting up beyond the selected gear.,,1,en
CDL-GK-0271,cdl,,general_knowledge,"What is a ""pull-up?""","When a driver stops and reverses direction to get a better position while backing, it is scored as a ""pull-up"". Stopping without changing direction does not count as a pull-up.",,1,en
CDL-GK-0272,cdl,,general_knowledge,When must you wear a seat belt?,"Federal regulations require the driver and all passengers in a moving CMV to wear seat belts unless, the vehicle isn't equipped with them.",,1,en
CDL-GK-0273,cdl,,general_knowledge,"When you drive in the mountains, you will have to use lower gears to drive safely down grades. Which of these does NOT affect your choice of gears?","Your most important consideration is to select a speed that is not too fast for the: total weight of the vehicle and cargo, length of the grade, steepness of the grade, road conditions, and weather.",,1,en
CDL-GK-0274,cdl,,general_knowledge,Serious traffic violations that can cause your CDL license to be suspended include,"Serious traffic violations are excessive speeding, reckless driving, improper or erratic lane changes, following a vehicle too closely, traffic offenses committed in a CMV in connection with fatal traffic accidents, etc.",,1,en
CDL-GK-0275,cdl,,general_knowledge,"There are certain types of vehicle inspection, including","Pre-trip occurs before you leave for your trip, En-route occurs during any break you take while driving, and post-trip occurs when your route is finished.",,1,en
CDL-GK-0276,cdl,,general_knowledge,Why should you signal continuously while turning?,Signal continuously. You need both hands on the wheel to turn safely. Don't cancel the signal until you have completed the turn.,,1,en
CDL-GK-0277,cdl,,general_knowledge,You are driving on a two-lane road. An oncoming vehicle drifts into your lane and is headed straight for you. Which of the following should you do?,"If an oncoming driver has drifted into your lane, a move to your right is best. If that driver realizes what has happened, the natural response will be to return to his or her own lane.",,1,en
CDL-GK-0278,cdl,,general_knowledge,Which of these statements is true about causes of vehicle fires?,"The following are some causes of vehicle fires: spilled fuel, improper use of flares, under-inflated tires , duals that touch, short circuits, loose connections, improper fueling, loose fuel connections, flammable cargo, improperly sealed or loaded cargo or with poor ventilation.",,1,en
CDL-GK-0279,cdl,,general_knowledge,What three things related to cargo are the driver's responsibility?,You must make sure the truck is not overloaded and the cargo is balanced and secured before each trip.,,1,en
CDL-GK-0280,cdl,,general_knowledge,What is your most valuable way to see the sides and rear while driving?,It's important to know what's going on behind and to the sides. Check your mirrors regularly. Check more often in special situations.,,1,en
CDL-GK-0281,cdl,,general_knowledge,"When checking lights, you should","Make sure the parking brake is set, turn off the engine, and take the key with you. Turn on headlights (low beams) and four-way emergency flashers and get out of the vehicle.",,1,en
CDL-GK-0282,cdl,,general_knowledge,"On a two-way, two-lane road, if you must stop on a hill, how far back should you place your reflective triangles?","If line of sight view is obstructed due to hill or curve, move the rear-most triangle to a point back down the road (up to 500 feet) so warning is provided.",,1,en
CDL-GK-0283,cdl,,general_knowledge,Name some things you should check on the FRONT of your vehicle during your pre-trip inspection.,"Go to front of vehicle and check that low beams are on and both of the four-way flashers are working, check that high beams, parking, clearance, side-marker, and identification lights work. Turn on right turn signal and start walk-around inspection, then check the left turn.",,1,en
CDL-GK-0284,cdl,,general_knowledge,Which of the following best describes how sleep debt can be paid off?,"If you don't sleep enough, you ""owe"" more sleep to yourself. This debt can only be paid off by sleeping.",,1,en
CDL-GK-0285,cdl,,general_knowledge,How can you avoid wet brake problems?,"Avoid driving through deep puddles or flowing water if possible. If not, you should: slow down and place transmission in a low gear, and gently put on the brakes.",,1,en
CDL-GK-0286,cdl,,general_knowledge,"When you start to drive down a steep downgrade, which of the following should influence your choice of speed?","Your most important consideration is to select a speed that is not too fast for the: total weight of the vehicle and cargo, length of the grade, steepness of the grade, road conditions, and weather.",,1,en
CDL-GK-0287,cdl,,general_knowledge,Always try to back toward the driver's side because,"Back to the driver's side so that you can see better. Backing toward the right side is very dangerous because you can't see as well. If you back and turn toward the driver's side, you can watch the rear of your vehicle by looking out the side window.",,1,en
CDL-GK-0288,cdl,,general_knowledge,On which of the following types of fires should you NOT use a B:C fire extinguisher?,"The B:C type fire extinguisher is designed to work on electrical fires and burning liquids, not on wood.",,1,en
CDL-GK-0289,cdl,,general_knowledge,You do not have a hazardous materials endorsement on your commercial driver's license. You are asked to haul hazardous materials in a placarded vehicle. You should:,"You can drive a vehicle that carries hazardous materials if it does not require placards. If it requires placards, you cannot drive it unless your driver license has the hazardous materials endorsement.",,1,en
CDL-GK-0290,cdl,,general_knowledge,You are testing the stopping action of service brakes on a hydraulic system. Which of these can mean there is a problem?,"With hydraulic systems a delay in braking, spongy or unusual feeling pedal, or pulling to one side or the other can mean there are issues.",,1,en
CDL-GK-0291,cdl,,general_knowledge,The center of gravity of a load:,"When more cargo is piled up in a truck, the ""center of gravity"" moves higher up from the road. The truck becomes easier to turn over.",,1,en
CDL-GK-0292,cdl,,general_knowledge,As part of your pre-trip inspection; you must,"As part of your Vehicle inspection, make sure the truck is not overloaded and the cargo is balanced and secured properly.",,1,en
CDL-GK-0293,cdl,,general_knowledge,Which of these statements about double clutching and shifting is true?,Use either the tachometer or the speedometer and upshift/downshift at the right rpm or road speed.,,1,en
CDL-GK-0294,cdl,,general_knowledge,Gross combination weight rating or GCWR means the following?,"The Gross Combination Weight Rating (GCWR) is the value specified by the manufacturer of the power unit and the towed unit(s), including load,  or any combination thereof.",,1,en
CDL-GK-0295,cdl,,general_knowledge,Which of these statements about managing space is true?,"Remember that when the road is slippery, you need much more space to stop, and should keep more space in front of your vehicle.",,1,en
CDL-GK-0296,cdl,,general_knowledge,"The road you are driving on becomes very slippery due to glare ice, which of these is a good thing to do in such a situation?","If the surface is icy, reduce speed to a crawl and stop driving as soon as you can safely do so.",,1,en
CDL-GK-0297,cdl,,general_knowledge,Which of these statements about downshifting is true?,"Slow down to a safe speed, and downshift to the right gear before entering the curve. This lets you use some power through the curve to help the vehicle be more stable while turning. It also allows you to speed up as soon as you are out of the curve.",,1,en
CDL-GK-0298,cdl,,general_knowledge,If a straight vehicle goes into a front wheel skid it will:,"In a front-wheel skid, the front end tends to go in a straight line regardless of how much you turn the steering wheel. On a very slippery surface, you may not be able to steer around a curve or turn.",,1,en
CDL-GK-0299,cdl,,general_knowledge,Which of these statements about cold weather driving is true?,Use windshield washer antifreeze to prevent freezing of the washer liquid.,,1,en
CDL-GK-0300,cdl,,general_knowledge,Retarders are used by?,"There are four basic types of retarders: exhaust, engine, hydraulic, and electric.",,1,en
CDL-GK-0301,cdl,,general_knowledge,You must drive on a slippery road. Which of these is a good thing to do in such a situation?,"I It will take longer to stop, and it will be harder to turn without skidding, when the road is slippery. Wet roads can double stopping distance at any speed, reduce speed, and slow down gradually on a wet road.",,1,en
CDL-GK-0302,cdl,,general_knowledge,Which of these is a sign of tire failure?,"When driving a loud bang, vibrations, or heavy steering can indicate that a tire has failed.",,1,en
CDL-GK-0303,cdl,,general_knowledge,Which of these statements about marking a stopped vehicle is true?,"If line of sight view is obstructed due to hill or curve, move the rear-most triangle to a point back down the road so warning is provided up to 500 feet.",,1,en
CDL-GK-0304,cdl,,general_knowledge,Which of these is a good driving rule for work zones?,"Driving in work zones require extra care, and because of the workers risking their lives to keep the road in good condition you should drive slowly, use your hazards, and use your brake lights as communication devices.",,1,en
CDL-GK-0305,cdl,,general_knowledge,"To transport cargo safely, which of the following are you NOT responsible for?","You cannot inspect sealed loads, but you should check that you don't exceed gross weight and axle weight limits, and that the cargo is properly secured.",,1,en
CDL-GK-0306,cdl,,general_knowledge,Which of the following CMVs are most likely to get stuck at a raised railroad crossing?,"These trailers can get stuck on raised crossings: Low slung units (lowboy, car carrier, moving van, possum-belly livestock trailer). Single-axle tractor pulling a long trailer with its landing gear set to accommodate a tandem-axle tractor.",,1,en
CDL-GK-0307,cdl,,general_knowledge,All of the following behaviors are signs of aggressive driving EXCEPT,"Aggressive driving is the act of operating a motor vehicle in a selfish, bold, or pushy manner, without regard for the rights or safety of others. The frequent changes of speed is a distracted driver trait.",,1,en
CDL-GK-0308,cdl,,general_knowledge,Which of these statements about escape ramps is true?,"Escape ramps are made to stop runaway vehicles safely without injuring drivers and passengers. Escape ramps save lives, equipment and cargo.",,1,en
CDL-GK-0309,cdl,,general_knowledge,How often must you stop to check your cargo while on the road?,"Inspect the cargo and its securing devices again within the first 50 miles after beginning a trip, and you will need to inspect again after you have driven for 3 hours or 150 miles and after every break you take during driving.",,1,en
CDL-GK-0310,cdl,,general_knowledge,Bridge formulas permit,A bridge formula permits less maximum axle weight for axles that are closer together. This is to prevent overloading bridges and roadways,,1,en
CDL-GK-0311,cdl,,general_knowledge,"As your blood alcohol concentration (BAC) rises, what happens?",Alcohol affects more and more of the brain as BAC builds up. The first part of the brain affected controls judgment and self-control.,,1,en
CDL-GK-0312,cdl,,general_knowledge,Which of these statements about cargo loading is true?,"You must keep weights within legal limits. States have maximums for GVWRs, GCWRs, and axle weights.",,1,en
CDL-GK-0313,cdl,,general_knowledge,What is the most important thing to remember about emergency braking?,"Emergency braking does not mean pushing down on the brake pedal as hard as you can. That will only keep the wheels locked up and cause a skid. If the wheels are skidding, you cannot control the vehicle.",,1,en
CDL-GK-0314,cdl,,general_knowledge,What are the regulations on the height of splash guards?,"Currently, there are no federal regulations governing the height of splash guards. Each state is free to issue its own regulations, and those regulations vary from one state to another.",,1,en
CDL-GK-0315,cdl,,general_knowledge,The tendency for long commercial vehicles to swing wide on turns is called,"When a vehicle goes around a corner, the rear wheels follow a different path than the front wheels. This is called off-tracking. Longer vehicles will off-track more, the rear wheels of the powered unit will off-track some, and the rear wheels of the trailer will off-track even more.",,1,en
CDL-GK-0316,cdl,,general_knowledge,What is hydroplaning?,"In some weather, water or slush collects on the road. When this happens, your vehicle can hydroplane. It's like water skiing--the tires lose their contact with the road and have little or no traction. You may not be able to steer or brake.",,1,en
CDL-GK-0317,cdl,,general_knowledge,"When driving a commercial vehicle with a height over 13 feet, you should",Hitting overhead objects is dangerous. Make sure you always have overhead clearance.,,1,en
CDL-GK-0318,cdl,,general_knowledge,Your blood alcohol concentration (BAC) depends on your,"BAC is determined by the amount of alcohol you drink, how fast you drink, and your weight.",,1,en
CDL-GK-0319,cdl,,general_knowledge,The purpose of retarders is to,"Retarders help slow a vehicle, reducing the need for using your brakes. They reduce brake wear and give you another way to slow down.",,1,en
CDL-GK-0320,cdl,,general_knowledge,Which of the following provide extra gears on some trucks?,Multi-speed rear axles and auxiliary transmissions are used on many vehicles to provide extra gears. You usually control them by a selector knob or switch on the gearshift lever of the main transmission.,,1,en
CDL-GK-0321,cdl,,general_knowledge,Which one of these is not part of the engine compartment pre-trip inspection?,Oil Level: Indicate where dipstick is located and see that oil level is within safe operating range. Engine Compartment Belts Check belts for snugness up to 3/4-inch play at center of belt with no cracks or frays. Hoses: Inspect hoses for condition and leaks. Valve clearance is the incorrect answer.,,1,en
CDL-GK-0322,cdl,,general_knowledge,How do you test hydraulic brakes for leaks?,"If the vehicle has hydraulic brakes, pump the brake pedal three times. Then apply firm pressure to the pedal and hold for five seconds. The pedal should not move. If it does, there may be a leak or other problem.",,1,en
CDL-GK-0323,cdl,,general_knowledge,Which of the following is most likely to cause a vehicle fire?,"The following are some causes of vehicle fires: Spilled fuel not properly cleaned up; improper use of flares; under-inflated tires and duals that touch; short circuits due to damaged insulation or loose connections; driver smoking in or around the vehicle; improper fueling and loose fuel connections; flammable cargo, improperly sealed or loaded cargo, with poor ventilation.",,1,en
CDL-GK-0324,cdl,,general_knowledge,"If the vehicle in front of you is smaller than yours, it can probably","Remember, if the vehicle ahead of you is smaller than yours, it can probably stop faster than you can. You may crash if you are following too closely.",,1,en
CDL-GK-0325,cdl,,general_knowledge,How far ahead should you be looking while driving in town?,"Most good drivers look at least 12 to 15 seconds ahead. That means looking ahead the distance you will travel in 12 to 15 seconds. At lower speeds, that's about one block.",,1,en
CDL-GK-0326,cdl,,general_knowledge,Name two causes of fires.,"The following are some causes of vehicle fires: spilled fuel, improper use of flares, under-inflated tires, duals that touch, short circuits, loose connections, improper fueling, loose fuel connections, flammable cargo that is improperly sealed or loaded cargo or has poor ventilation.",,1,en
CDL-GK-0327,cdl,,general_knowledge,When should you review the post-trip inspection report from the previous driver?,"Before performing the pre-trip inspection on your vehicle, you must review the inspection report made by the previous driver. Only if defects reported earlier have been certified as repaired or not needed to be repaired, should you sign the previous driver's report.",,1,en
CDL-GK-0328,cdl,,general_knowledge,"While driving, you see a small square cardboard box ahead in your lane. You should:",Steering around the object when it is safe to do is the safest action.,,1,en
CDL-GK-0329,cdl,,general_knowledge,In which of the following two situations should you downshift?,"Special conditions where you should downshift are: before starting down a hill slow down and shift down to a speed that you can control without using the brakes hard, and before entering a curve slow down to a safe speed and downshift to the right gear before entering the curve.",,1,en
CDL-GK-0330,cdl,,general_knowledge,Which of these can cause the vehicle to skid?,"Turning too sharply, not enough weight on the front axle, and over acceleration are all example of how to cause vehicle skids.",,1,en
CDL-GK-0331,cdl,,general_knowledge,When looking ahead of your vehicle while driving you should,"Good drivers shift their attention back and forth, near and far.",,1,en
CDL-GK-0332,cdl,,general_knowledge,Which of these statements about engine overheating is true?,Never remove the radiator cap or any part of the pressurized system until the system has cooled. Steam and boiling water can spray under pressure and cause severe burns.,,1,en
CDL-GK-0333,cdl,,general_knowledge,Escape ramps are,Escape ramps are made to stop runaway vehicles safely without injuring drivers and passengers.,,1,en
CDL-GK-0334,cdl,,general_knowledge,The braking effect of the engine is greatest when the engine is _____ the governed rpm and the transmission is in the ______ gears.,The braking effect of the engine is greatest when it is near the governed rpms and the transmission is in the lower gears.,,1,en
CDL-GK-0335,cdl,,general_knowledge,Which of the following materials can be used in a Class ABC fire extinguisher to put out fires?,An ABC fire extinguisher is a multi-purpose extinguisher and usually uses dry chemicals.,,1,en
CDL-GK-0336,cdl,,general_knowledge,You are checking your brakes and suspension system for a pre-trip inspection. What are you looking for?,"Brake linings must not be loose or soaked with oil or grease, and must not be dangerously thin, broken, or missing.",,1,en
CDL-GK-0337,cdl,,general_knowledge,How does the height of the vehicle's center of gravity affect safe handling?,High center of gravity means that much of the load's weight is carried high up off the road. This makes the vehicle top-heavy and easy to roll over.,,1,en
CDL-GK-0338,cdl,,general_knowledge,"In rain, you should reduce your speed by?",Wet roads can double stopping distance. You must drive slower to be able to stop in the same distance as on a dry road. Reduce speed by about one-third on a wet road.,,1,en
CDL-GK-0339,cdl,,general_knowledge,Gross vehicle weight rating or GVWR means the following:,The Gross Vehicle Weight Rating (GVWR) is the value specified by the manufacturer as the loaded weight of a single vehicle.,,1,en
CDL-GK-0340,cdl,,general_knowledge,Which of these statements about tires and hot weather driving is true?,"Inspect the tires more often than usual, or every two hours or every 100 miles when driving in very hot weather.",,1,en
CDL-GK-0341,cdl,,general_knowledge,Tank vehicles are used to carry any liquid and are dangerous to drive because:,Hauling liquids in tanks requires special skills because of the high center of gravity and liquid movement.,,1,en
CDL-GK-0342,cdl,,general_knowledge,How often should you check your mirrors?,You should check your mirrors every 8 to 10 seconds to know what is going on around your vehicle at all times.,,1,en
CDL-GK-0343,cdl,,general_knowledge,How can you determine if your vehicle is equipped with an antilock braking system (ABS)?,"Most vehicles now have an ABS light on the instrument panel that will light up briefly when the vehicle is started to alert you that the vehicle has ABS, you can check to see if the vehicle was built on or after March 1, 1998, or you can check for wires from your brakes.",,1,en
CDL-GK-0344,cdl,,general_knowledge,"If a straight vehicle (no trailer or articulation) goes into a front-wheel skid, it will","In a front-wheel skid, the front end tends to go in a straight line regardless of how much you turn the steering wheel.",,1,en
CDL-GK-0345,cdl,,general_knowledge,"When driving at night, use your low beams when an oncoming vehicle is within",Dim your lights within 500 feet of an oncoming vehicle and when following another vehicle within 500 feet.,,1,en
CDL-GK-0346,cdl,,general_knowledge,What are some things to do at an accident scene to prevent another accident?,"Protect the accident area: if your vehicle is involved in the accident, try to get it to the side of the road, if you're stopping to help, park away from the accident, put on your flashers, and set out reflective triangles to warn other traffic.",,1,en
CDL-GK-0347,cdl,,general_knowledge,Why should you be in the proper gear before starting down a hill?,Do not try to downshift after your speed has already built up. You will not be able to shift into a lower gear. You may not even be able to get back into any gear and all engine braking effect will be lost.,,1,en
CDL-GK-0348,cdl,,general_knowledge,"When driving through roadway work zones, you should","When people are working on the road, it is a hazard. There may be narrower lanes, sharp turns, or uneven surfaces.",,1,en
CDL-GK-0349,cdl,,general_knowledge,"To prevent skidding, you should","Don't over steer, over accelerate, or over brake by adjusting to conditions while driving. These include traction, curves, visibility, traffic and hills.",,1,en
CDL-GK-0350,cdl,,general_knowledge,"A car suddenly cuts in front of you, creating a hazard. What should you NOT do?","What you should do is make a lane change or slow down to prevent a crash if the car suddenly cuts in front of you, and you should not honk or stay close behind the car.",,1,en
CDL-GK-0351,cdl,,general_knowledge,A key principle to remember about loading cargo is to keep the load,Poor weight balance can make vehicle handling unsafe. The cargo should be loaded so that it is balanced in the cargo area.,,1,en
CDL-GK-0352,cdl,,general_knowledge,What can you do at an accident scene to help avoid another accident?,"When you're in an accident and not seriously hurt, you need to act to prevent further damage or injury. The basic steps to be taken at any accident are to: protect the area, notify authorities, and care for the injured.",,1,en
CDL-GK-0353,cdl,,general_knowledge,"As the blood alcohol concentration or BAC goes up, what will happen?",Accident statistics show that the chance of a crash is much greater for drivers who have been drinking than for drivers who have not.,,1,en
CDL-GK-0354,cdl,,general_knowledge,When does hydroplaning occur?,"Hydroplaning is more likely if tire pressure is low, or the tread is worn. The grooves in a tire carry away the water; if they aren't deep, they don't work well.",,1,en
CDL-GK-0355,cdl,,general_knowledge,The height of the vehicle center of gravity is very important for safe handling. A high center of gravity means you are more likely to do the following:,"The height of the vehicle's center of gravity is very important for safe handling. A high center of gravity means you are more likely to tip over. It is most dangerous in curves, or if you have to swerve to avoid a hazard.",,1,en
CDL-GK-0356,cdl,,general_knowledge,Which of these statements about vehicle fires is true?,A burning tire must be cooled. Lots of water may be required.,,1,en
CDL-GK-0357,cdl,,general_knowledge,Cargo should have at least one tie down for each:,Cargo should have at least one tie-down for each ten feet of cargo. Make sure you have enough tiedowns to meet this need.,,1,en
CDL-GK-0358,cdl,,general_knowledge,"During a pre-trip inspection you discover an exhaust leak or power steering leak, you should:","If you find anything unsafe during the Vehicle inspection, get it fixed, or use a different vehicle. Federal and state laws forbid operating an unsafe vehicle.",,1,en
