external_id,license_code,state_code,category_code,text,explanation,image_name,difficulty,lang
CDL-AB-0001,cdl,,air_brakes,"Oil and water usually collect in compressed air tanks. If you do not have an automatic tank drain, when should you drain the air tanks?","If your vehicle does not have automatic air tank drains, drain your air tanks at the end of each working day to remove moisture and oil. Otherwise, the brakes could fail.",,1,en
CDL-AB-0002,cdl,,air_brakes,What is the S-cam used for?,"When you push the brake pedal, air is let into each brake chamber. Air pressure pushes the rod out, moving the slack adjuster, thus twisting the brake camshaft. This turns the s-cam forcing the brake shoes away from one another and presses them against the inside of the brake drum.",,1,en
CDL-AB-0003,cdl,,air_brakes,Which of the following makes the total stopping distance for air brakes longer than that for hydraulic brakes?,"With air brakes there is an added delay or Brake Lag. This is the time required for the brakes to work after the brake pedal is pushed. With hydraulic brake, the brakes work instantly. With air brakes it takes a little time, one half second or more, for the air to flow through the lines to the brakes.",,1,en
CDL-AB-0004,cdl,,air_brakes,The brake system that applies and releases the brakes when the driver uses the brake pedal is the:,The service brake system applies and releases the brakes when you use the brake pedal during normal driving.,,1,en
CDL-AB-0005,cdl,,air_brakes,"To make an emergency stop with air brakes, using the stab braking method, you should:","Stab braking means that you: apply your brakes all the way, and release brakes when wheels lock up. As soon as the wheels start rolling, apply the brakes fully again.",,1,en
CDL-AB-0006,cdl,,air_brakes,Brake lag distance at 55 mph is _____ feet?,The air brake lag distance at 55 mph on dry pavement adds about 32 feet.,,1,en
CDL-AB-0007,cdl,,air_brakes,"If your vehicle has an alcohol evaporator, it is there to:",Some air brake systems have an alcohol evaporator to put alcohol into the air system. This helps to reduce the risk of ice in air brake valves and other parts during cold weather. Daily air tank drainage is still needed to get rid of water and oil.,,1,en
CDL-AB-0008,cdl,,air_brakes,"What can legally hold a parking or emergency brake in position for a truck, truck tractor or bus?","All trucks, truck tractors, and buses must be equipped with emergency brakes and parking brakes. They must be held on by mechanical force because air pressure can eventually leak away. Spring brakes are usually used to meet these needs.",,1,en
CDL-AB-0009,cdl,,air_brakes,The braking power of the spring brakes:,"The braking power of spring brakes depends on the brakes being in adjustment. If the brakes are not adjusted properly, neither the regular brakes nor the emergency/parking brakes will work right.",,1,en
CDL-AB-0010,cdl,,air_brakes,Which of the following should you do before leaving your vehicle unattended?,Never leave your vehicle unattended without applying the parking brakes or chocking the wheels. Your vehicle might roll away and cause injury and damage,,1,en
CDL-AB-0011,cdl,,air_brakes,Under which conditions are front wheel brakes good?,Front wheel brakes have been shown to be ideal under all weather and driving conditions. Front wheel braking is unlikely to cause a skid even on icy roads.,,1,en
CDL-AB-0012,cdl,,air_brakes,"If the air tanks are not drained,","Compressed air usually has some water and some compressor oil in it, which is bad for the air brake system. For example, the water can freeze in cold weather and cause brake failure.",,1,en
CDL-AB-0013,cdl,,air_brakes,An antilock braking system (ABS),ABS is a computerized system that keeps your wheels from locking up during hard brake applications.,,1,en
CDL-AB-0014,cdl,,air_brakes,Which of the following can cause brakes to fade or fail?,Brakes can fade or fail from excessive heat caused by using them too much and not relying on the engine braking effect. Brake fade is also affected by adjustment.,,1,en
CDL-AB-0015,cdl,,air_brakes,What is the best way to test if your vehicle's spring brakes come on automatically?,"On both tractor-trailers and single vehicles, to test whether the spring brakes will come on automatically, use the same method you use for testing the low air pressure warning signal: Step on and off the brake pedal, this time until you reach an even lower psi reading and the parking brake valve closes or pops out.",,1,en
CDL-AB-0016,cdl,,air_brakes,"If your vehicle has a properly functioning dual air brake system and minimum-sized air tanks, the air pressure should build from 85 to 100 psi within ____ seconds.","When the engine is at operating rpms, the pressure should build from 85 to 100 psi within 45 seconds in dual air systems. If the vehicle has larger than minimum air tanks, the buildup time can be longer and still be safe.",,1,en
CDL-AB-0017,cdl,,air_brakes,The air compressor will stop pumping air into the air tanks at ____ psi.,"The governor controls when the air compressor will pump air into the air storage tanks. When air tank pressure rises to the ""cut-out"" level around 125 psi, the governor stops the compressor from pumping air. When the tank pressure falls to the ""cut-in"" pressure around 100 psi, the governor allows the compressor to start pumping again.",,1,en
CDL-AB-0018,cdl,,air_brakes,Excessive heat caused by overuse of the service brakes can cause,Brakes can fade or fail from excessive heat caused by using them too much and not relying on the engine braking effect.,,1,en
CDL-AB-0019,cdl,,air_brakes,"Excessive use of the service brakes may result in overheating, which can lead to","Brake fade results from excessive heat causing chemical changes in the brake lining, which reduce friction, and also causing expansion of the brake drums.",,1,en
CDL-AB-0020,cdl,,air_brakes,A typical air brake system is fully charged at,Pumping by the air compressor should start at about 100 psi and stop at about 125 psi.,,1,en
CDL-AB-0021,cdl,,air_brakes,"During normal driving, spring brakes are usually held back by","Parking or emergency brakes must be held on by mechanical force because air pressure can eventually leak away. Spring brakes are usually used to meet these needs. When driving, powerful springs are held back by air pressure.",,1,en
CDL-AB-0022,cdl,,air_brakes,"During your final air brake check, if the air pressure does not build up fast enough,","If air pressure does not build up fast enough, your pressure may drop too low during driving, requiring an emergency stop. Don't drive until you get the problem fixed.",,1,en
CDL-AB-0023,cdl,,air_brakes,"To test the static air leakage rate, you should","With a fully-charged air system (typically 125 psi), turn off the engine, release the parking brake (push in); and time the air pressure drop.",,1,en
CDL-AB-0024,cdl,,air_brakes,Air brakes use _________ to make the brakes work.,"Air brakes use compressed air to make the brakes work. Air brakes are a good and safe way of stopping large and heavy vehicles, but the brakes must be well maintained and used properly.",,1,en
CDL-AB-0025,cdl,,air_brakes,"When you press the brake pedal,","When you push the brake pedal, air is let into each brake chamber.",,1,en
CDL-AB-0026,cdl,,air_brakes,The air compressor governor controls:,"The governor controls when the air compressor will pump air into the air storage tanks. When air tank pressure rises to the ""cut-out"" level around 125 psi, the governor stops the compressor from pumping air. When the tank pressure falls to the ""cut-in"" pressure around 100 psi, the governor allows the compressor to start pumping again.",,1,en
CDL-AB-0027,cdl,,air_brakes,"Of the choices below, the first thing to do when a low air pressure warning comes on is:","When the low air pressure warning light and buzzer first come on, bring the vehicle to a safe stop right away, while you can still control the brakes.",,1,en
CDL-AB-0028,cdl,,air_brakes,Air brake equipped vehicles must have:,"All vehicles with air brakes have a pressure gauge connected to the air tank. If the vehicle has a dual air brake system, there will be a gauge for each half of the system.",,1,en
CDL-AB-0029,cdl,,air_brakes,"Modern air brake systems combines three different systems.  They are the service brakes, the parking brakes and the:","Air brakes are really three different braking systems: service brake, parking brake, and emergency brake.",,1,en
CDL-AB-0030,cdl,,air_brakes,"If you must make an emergency stop, you should brake so that you:","You should brake in a way that will keep your vehicle in a straight line and allow you to turn if it becomes necessary. You can use the ""controlled braking"" method or the ""stab braking"" method.",,1,en
CDL-AB-0031,cdl,,air_brakes,The driver must be able to see a warning that is given before air pressure in the service air tanks falls below:,"Low air warning devices (buzzer, light, flag) should activate before air pressure drops below 60 psi or level specified by the manufacturer.",,1,en
CDL-AB-0032,cdl,,air_brakes,The most common type of foundation brakes found on heavy vehicles is the:,Wedge brakes and disc brakes are less common than s-cam brakes.,,1,en
CDL-AB-0033,cdl,,air_brakes,When driving down a long steep hill you should:,"Snub braking method is used for steep downhill grades, in this method apply the brakes just hard enough to feel a definite slowdown. When your speed has been reduced to approximately five mph below your ""safe"" speed, release the brakes. When your speed has increased to your ""safe"" speed, repeat.",,1,en
CDL-AB-0034,cdl,,air_brakes,The modulating control valve is?,"In some vehicles, a control handle on the dash board may be used to apply the spring brakes gradually. This is called a modulating valve. It is spring loaded, so you have a feel for the braking action. The more you move the control lever, the harder the spring brakes come on. They work this way, so you can control the spring brakes if the service brakes fail.",,1,en
CDL-AB-0035,cdl,,air_brakes,Which of the following will be true about your brake function if your antilock braking system (ABS) fails?,Without ABS you still have normal brake functions. Drive and brake as you always have.,,1,en
CDL-AB-0036,cdl,,air_brakes,Which of the following is not part of the braking process when you're driving a tractor-trailer combination vehicle with an antilock braking system (ABS)?,"You should not drive faster to keep the tractor and trailer straight. When you drive a vehicle with ABS, you should brake as you always have. In other words: use only the braking force necessary to stop safely and stay in control; brake the same way regardless of whether you have ABS on the bus, tractor, the trailer, or both; as you slow down monitor your tractor and trailer and back off the brakes if it is safe to do so to stay in control.",,1,en
CDL-AB-0037,cdl,,air_brakes,Which of the following are true about a dual air brake system?,"Most heavy-duty vehicles use dual air brake systems for safety. A dual air brake system has two separate air brake systems, which use a single set of brake controls. One system or primary system typically operates the regular brakes on the rear axle or axles. The other or secondary system operates the regular brakes on the front axle and possibly one rear axle.",,1,en
CDL-AB-0038,cdl,,air_brakes,How can you tell if your vehicle is equipped with an antilock braking system (ABS)?,"The Department of Transportation requires that ABS be on: air brake vehicles built on or after March 1, 1998.",,1,en
CDL-AB-0039,cdl,,air_brakes,Spring brakes are,"Spring brakes are an important backup system: powerful springs that automatically apply the brakes if they sense that air pressure has been lost for some reason, such as a leak. They will also apply the brakes if the psi gets too low, although ideally, you should take control of your brakes before that happens.",,1,en
CDL-AB-0040,cdl,,air_brakes,"In the event of a brake system failure, the emergency brake system uses __________ to stop the vehicle.",The emergency brake system uses parts of the service and parking brake systems to stop the vehicle in a brake system failure.,,1,en
CDL-AB-0041,cdl,,air_brakes,Repeatedly pressing and releasing (fanning) the brake pedal may result in,"Each time you release the brakes, some compressed air leaves the system and must be replenished by the air compressor. If you keep pressing and releasing the brake pedal, air may leave the system faster than the air compressor can replenish it, and the air pressure may drop to the point that the brakes won't work.",,1,en
CDL-AB-0042,cdl,,air_brakes,"If the spring brakes are on, when should you push the brake pedal?","Never push the brake pedal down when the spring brakes are on. If you do, the brakes could be damaged by the combined forces of the springs and the air pressure.",,1,en
CDL-AB-0043,cdl,,air_brakes,You'll know that your brakes are fading if,"As the overheated drums expand, the brake shoes and linings have to move farther to contact the drums, and the force of this contact is reduced. So, you will be pressing harder on the pedal.",,1,en
CDL-AB-0044,cdl,,air_brakes,A converter dolly with antilock brakes (ABS) is required to have,"Converter dollies built on or after March 1, 1998, are required to have antilock brakes. These dollies will have a yellow lamp on the left side of the dolly.",,1,en
CDL-AB-0045,cdl,,air_brakes,Which of the following is the most important thing about hard braking?,"Emergency braking does not mean pushing down on the brake pedal as hard as you can. That will only keep the wheels locked up and cause a skid. If the wheels are skidding, you cannot control the vehicle.",,1,en
CDL-AB-0046,cdl,,air_brakes,"In controlled braking, you","You apply the brakes as hard as you can without locking the wheels. Keep steering wheel movements very small while doing this. If you need to make a larger steering adjustment or if the wheels lock, release the brakes. Re-apply the brakes as soon as you can.",,1,en
CDL-AB-0047,cdl,,air_brakes,"If oil and water collects in the air tanks, what could happen to the brakes?","Compressed air usually has some water and some compressor oil in it, which is bad for the air brake system. For example, the water can freeze in cold weather and cause brake failure.",,1,en
CDL-AB-0048,cdl,,air_brakes,"S-cam drum brakes have an S-cam in each brake chamber. Why is it called an ""S-cam?""",The S-cam is S-shaped. The s-cam forces the brake shoes away from one another and presses them against the inside of the brake drum.,,1,en
CDL-AB-0049,cdl,,air_brakes,"To test the air service brakes,","Pull forward at 5 mph, apply the service brake and stop. Check to see that the vehicle does not pull to either side and that it stops when brake is applied.",,1,en
CDL-AB-0050,cdl,,air_brakes,When can you leave your truck unattended without first applying the parking brakes or chocking the wheels?,Never leave your vehicle unattended without applying the parking brakes or chocking the wheels. Your vehicle might roll away and cause injury and damage.,,1,en
CDL-AB-0051,cdl,,air_brakes,If your truck or bus has dual parking control valves it means that you can use pressure from a separate tank to:,"When main air pressure is lost, the spring brakes come on. Some vehicles have a separate air tank which can be used to release the spring brakes. This is so you can move the vehicle in an emergency.",,1,en
CDL-AB-0052,cdl,,air_brakes,The brake pads should be _____ for the brakes to be on?,"To stop, the brake shoes and linings are pushed against the inside of the drum. This causes friction, which slows the vehicle.",,1,en
CDL-AB-0053,cdl,,air_brakes,You should know that your brakes are fading when:,Increasing application pressure to hold the same speed means the brakes are fading.,,1,en
CDL-AB-0054,cdl,,air_brakes,The application pressure gauge shows the driver how much pressure:,Application Pressure Gauge shows how much air pressure you are applying to the brakes.,,1,en
CDL-AB-0055,cdl,,air_brakes,"If the air compressor should develop a leak, what keeps the air in the tanks?","Installed on the compressor side of the air tank is a one-way check valve, it allows air into the tanks, but does not allow it to flow back to the compressor.",,1,en
CDL-AB-0056,cdl,,air_brakes,Why drain water from the compressed air tanks?,"Compressed air usually has some water and some compressor oil in it, which is bad for the air brake system, the water can freeze in cold weather and cause brake failure. The water and oil tend to collect in the bottom of the air tank. Be sure that you drain the air tanks completely.",,1,en
CDL-AB-0057,cdl,,air_brakes,"During normal driving, spring brakes are usually held back by:","When driving, powerful springs are held back by air pressure. If the air pressure is removed, the springs put on the brakes.",,1,en
CDL-AB-0058,cdl,,air_brakes,Brake drums must not have cracks longer than _____ the width of the friction area?,Brake drums or discs must not have cracks longer than one half the width of the friction area.,,1,en
CDL-AB-0059,cdl,,air_brakes,"After the initial drop, the maximum acceptable leakage rates per minute are","With a fully-charged air system typically 125 psi, turn off the engine, release the parking brake; and time the air pressure drop. The loss rate should be less than two psi in one minute for single vehicles brakes released and three with the brakes applied, and less than three psi in one minute for combination vehicles with the brakes released and four with the brakes applied.",,1,en
CDL-AB-0060,cdl,,air_brakes,"How do brakes work on a long, steep downgrade?",The use of brakes on a long and/or steep downgrade is only a supplement to the braking effect of the engine.,,1,en
CDL-AB-0061,cdl,,air_brakes,How would you check your truck's slack adjusters?,"Use gloves and pull hard on each slack adjuster that you can reach. If a slack adjuster moves more than about one inch where the push rod attaches to it, it probably needs adjustment.",,1,en
CDL-AB-0062,cdl,,air_brakes,The parking brake control,A parking brake control in the cab allows the driver to let the air out of the spring brakes. This lets the springs put the brakes on.,,1,en
CDL-AB-0063,cdl,,air_brakes,"If the low air pressure warning signal is not working,","If the warning signal doesn't work, you could lose air pressure and you would not know it. This could cause sudden emergency braking in a single-circuit air system. In dual systems the stopping distance will be increased. Only limited braking can be done before the spring brakes come on.",,1,en
CDL-AB-0064,cdl,,air_brakes,Your vehicle has a dual air brake system. One of the systems loses air pressure. What will happen?,"A dual air brake system has two separate air brake systems, which use a single set of brake controls. Each system has its own air tanks, hoses, lines, etc. One system typically operates the regular brakes on the rear axle or axles. The other system operates the regular brakes on the front axle and possibly one rear axle.",,1,en
CDL-AB-0065,cdl,,air_brakes,"Under ideal conditions, the average driver of a truck or bus equipped with air brakes and traveling at 55 mph would require what stopping distance?","The total minimum distance your vehicle has traveled, in ideal conditions; with everything considered, including perception distance, reaction distance and braking distance, until you can bring your vehicle to a complete stop. At 55 mph, your vehicle will travel about 450 feet.",,1,en
CDL-AB-0066,cdl,,air_brakes,"Modern air brake systems are three different systems combined: the service brakes, parking brakes, and _______ brakes.","Air brakes are really three different braking systems: service brake, parking brake, and emergency brake.",,1,en
CDL-AB-0067,cdl,,air_brakes,To check the free play of manual slack adjusters on S-cam brakes you should:,"For manual slack adjustors, the brake pushrod should not move more than one inch, with the brakes released, when pulled by hand.",,1,en
CDL-AB-0068,cdl,,air_brakes,"Your truck or bus has a dual air brake system. If a low air pressure warning comes on for only one system, what should you do?","The warning light and buzzer should come on before the air pressure drops below 60 psi in either system. If this happens while driving, you should stop right away and safely park the vehicle. If one air system is very low on pressure, either the front or the rear brakes will not be operating fully. This means it will take you longer to stop. Bring the vehicle to a safe stop and have the air brakes system fixed.",,1,en
CDL-AB-0069,cdl,,air_brakes,"If your vehicle has an alcohol evaporator, every day during cold weather you should:","Check the alcohol container and fill up as necessary, every day during cold weather.",,1,en
CDL-AB-0070,cdl,,air_brakes,"With S-cam drum brakes, when the brake chamber fills with air, air pressure pushes the push rod out, moving the ________ and thus rotating the ________.","In S-cam brakes when you push the brake pedal, air is let into each brake chamber. Air pressure pushes the rod out, moving the slack adjuster, thus twisting the brake camshaft. This turns the s-cam. The s-cam forces the brake shoes away from one another and presses them against the inside of the brake drum.",,1,en
CDL-AB-0071,cdl,,air_brakes,In which of the following situations should you NOT apply the parking brakes?,"Don't use the parking brakes if the brakes are very hot (from just having come down a steep grade), or if the brakes are very wet in freezing temperatures. If they are used while they are very hot, they can be damaged by the heat. If they are used in freezing temperatures when the brakes are very wet, they can freeze so the vehicle cannot move. Use wheel chocks instead.",,1,en
CDL-AB-0072,cdl,,air_brakes,Which of the following can cause brakes to fail or fade?,"Brakes can fade or fail from excessive heat caused by using them too much and not relying on the engine braking effect, they are also affected by adjustment, and low air pressure.",,1,en
CDL-AB-0073,cdl,,air_brakes,"If you need to stop quickly and your vehicle lacks antilock brakes, you can use","You should brake in a way that will keep your vehicle in a straight line and allow you to turn if it becomes necessary. You can use the ""controlled braking"" method or the ""stab braking"" method.",,1,en
CDL-AB-0074,cdl,,air_brakes,Tractor and straight truck spring brakes will come fully on when the air pressure drops to a range of,Tractor and straight truck spring brakes will come fully on when air pressure drops to a range of 20 to 45 psi (typically 20 to 30 psi).,,1,en
CDL-AB-0075,cdl,,air_brakes,The modulating control valve allows you to control the,"In some vehicles a control handle on the dash board may be used to apply the spring brakes gradually. This is called a modulating valve. It is spring-loaded, so you have a feel for the braking action. The more you move the control lever, the harder the spring brakes come on.",,1,en
CDL-AB-0076,cdl,,air_brakes,Air loss in a straight truck or bus should not be more than _____ with the engine off and the brakes applied.,"With a fully-charged air system, turn off the engine, release the parking brake, and time the air pressure drop. The loss rate should be less than two psi in one minute for single vehicle brakes released, and three with the brakes applied.",,1,en
CDL-AB-0077,cdl,,air_brakes,What activates the stop switch?,Drivers behind you must be warned when you put your brakes on. The air brake system does this with an electric switch that works by air pressure. The switch turns on the brake lights when you put on the air brakes.,,1,en
CDL-AB-0078,cdl,,air_brakes,A straight truck or bus air brake system should not leak at a rate of more than ____ psi per minute with the engine off and the brakes released.,"With a fully-charged air system, turn off the engine, release the parking brake, and time the air pressure drop. The loss rate should be less than two psi in one minute for single vehicle brakes released, and three with the brakes applied.",,1,en
CDL-AB-0079,cdl,,air_brakes,Vehicles with air brakes must have:,"All vehicles with air brakes have a pressure gauge connected to the air tank. If the vehicle has a dual air brake system, there will be a gauge for each half of the system.",,1,en
CDL-AB-0080,cdl,,air_brakes,Slack adjusters should not have any more than _____ of play?,"Park on level ground and chock the wheels to prevent the vehicle from moving, release the parking brakes so you can move the slack adjusters, using gloves and pull hard on each slack adjuster that you can reach, and if a slack adjuster moves more than about one inch where the push rod attaches to it then adjustments are needed.",,1,en
CDL-AB-0081,cdl,,air_brakes,What is the best way to test your vehicle's low air pressure warning signal?,Shut the engine off when you have enough air pressure so that the low-pressure warning signal is not on. Turn the electrical power on and step on and off the brake pedal to reduce air tank pressure. The low air pressure warning signal must come on before the pressure drops to less than 60 psi in the air tank.,,1,en
CDL-AB-0082,cdl,,air_brakes,Which vehicles must have low air pressure warning signals?,A low air pressure warning signal is required on vehicles with air brakes.,,1,en
